Indicateurs dรฉmographiques,1968 ร  1975,1975 ร  1982,1982 ร  1990,1990 ร  1999,1999 ร  2006,2006 ร  2011,2011 ร  2016,2016 ร  2022
Variation annuelle moyenne de la population en %,"14,2","9,0","2,4","1,1","0,2","1,9","1,3","1,0"
due au solde naturel en %,"0,3","0,2","0,2","0,2","โ€“0,2","โ€“0,2","โ€“0,1","โ€“0,5"
due au solde apparent des entrรฉes sorties en %,"13,8","8,8","2,2","0,9","0,4","2,1","1,4","1,5"
Taux de natalitรฉ (โ€ฐ),"13,8","9,4","7,6","9,3","8,3","8,8","8,9","6,3"
Taux de mortalitรฉ (โ€ฐ),"10,4","7,4","5,9","7,3","10,4","10,4","10,2","11,3"
